{"analysis_input_id":"019c1234-0000-7000-8000-000000000001","created_at":"2026-07-26T12:00:01.000000Z","evidence_items":[{"path":"/evidence/source_trust/freshness/status","value":"current"},{"path":"/evidence/strategy/decisions/0/disposition","value":"candidate"},{"path":"/evidence/strategy/decisions/0/confidence","value":"0.81"},{"path":"/evidence/risk","value":null},{"path":"/evidence/decision/availability","value":"not_implemented"}],"purpose":"strategy_explanation","schema_version":"ai_analysis_input.v1","snapshot":{"canonicalization_profile":"atlas-jcs.v1","evidence_digest":"28bf3b99c953c94eaa5ca5b9f8d48c83b495445cd327f0be61ee5c60eee81c6c","evidence_profile":"trader_now_complete.v1","integrity_status":"verified","snapshot_id":"019849d1-8c00-7000-8000-000000000001","snapshot_schema_version":"trader_now_snapshot.v1"}}
